{
  "$schema": "https://json-schema.org/draft/2020-12/schema",
  "$id": "https://github.com/Eistee82/Keylegend/devices/device-profile.schema.json",
  "title": "Keylegend device profile",
  "description": "Describes one keyboard model in one physical layout: where every key sits, and which cell of the vendor LED matrix lights it. Adding a keyboard to Keylegend means writing one of these — never changing the program.",
  "type": "object",
  "required": ["formatVersion", "name", "vendor", "model", "physicalLayout", "canvas", "matrix", "keys"],
  "additionalProperties": false,
  "properties": {
    "$schema": {
      "type": "string",
      "description": "Points an editor at this file, so it can offer completion and flag mistakes while you type."
    },
    "formatVersion": {
      "type": "integer",
      "minimum": 1,
      "description": "Revision of this format. Currently 1. A build refuses a profile numbered higher than it understands."
    },
    "name": {
      "type": "string",
      "minLength": 1,
      "description": "What the interface shows, e.g. \"Razer DeathStalker V2\"."
    },
    "vendor": {
      "type": "string",
      "description": "Who makes the keyboard. \"Generic\" for a profile that describes a layout rather than a model."
    },
    "model": {
      "type": "string",
      "description": "The model, as the vendor writes it."
    },
    "physicalLayout": {
      "type": "string",
      "description": "The physical key arrangement, NOT the software layout: ANSI-US, ISO-DE, ISO-FR, JIS-JP, ABNT2-BR and so on. It decides the shape of the Enter key and whether the extra ISO keys exist. Which characters those keys produce is asked from Windows at runtime, so one profile serves every software layout on the same hardware.",
      "examples": ["ANSI-US", "ISO-DE", "ISO-UK", "ISO-FR", "JIS-JP", "ABNT2-BR"]
    },
    "image": {
      "type": ["string", "null"],
      "description": "Optional file name of a picture next to the profile. Currently unused — the preview is drawn from the geometry below. Only attach a picture you took or made yourself: everything here ships under the MIT licence, and a vendor's product render cannot."
    },
    "usb": {
      "type": ["object", "null"],
      "description": "The USB identity of the keyboard, which is what lets it be recognised rather than guessed. Windows reports the same pair for attached hardware. Find yours with: Get-PnpDevice -Class Keyboard — the instance id contains VID_1532 and PID_0295. A vendor uses one product id across layouts, so a match narrows the choice to a model; the ISO or ANSI variant is then decided from the active Windows keyboard layout.",
      "required": ["vendorId", "productId"],
      "additionalProperties": false,
      "properties": {
        "vendorId": { "type": "string", "pattern": "^[0-9A-Fa-f]{1,4}$", "examples": ["1532"] },
        "productId": { "type": "string", "pattern": "^[0-9A-Fa-f]{1,4}$", "examples": ["0295"] }
      }
    },
    "note": {
      "type": ["string", "null"],
      "description": "Free text for whoever opens the file next: what is still unchecked, which model it was written against, what surprised the person who calibrated it."
    },
    "canvas": {
      "type": "object",
      "description": "The coordinate system every key position refers to. Only ratios matter — the preview scales the whole thing to the room it has.",
      "required": ["width", "height"],
      "additionalProperties": false,
      "properties": {
        "width": { "type": "number", "exclusiveMinimum": 0 },
        "height": { "type": "number", "exclusiveMinimum": 0 }
      }
    },
    "matrix": {
      "type": "object",
      "description": "Size of the vendor LED matrix. Razer keyboards are 6 rows by 22 columns, whatever their size — a compact keyboard simply populates fewer cells.",
      "required": ["rows", "columns"],
      "additionalProperties": false,
      "properties": {
        "rows": { "type": "integer", "minimum": 1 },
        "columns": { "type": "integer", "minimum": 1 }
      }
    },
    "verified": {
      "type": "boolean",
      "default": false,
      "description": "True only once somebody has stepped through the calibration on the real keyboard and confirmed that every key lights where the profile says. Geometry can be derived; this cannot."
    },
    "keys": {
      "type": "array",
      "minItems": 1,
      "items": { "$ref": "#/$defs/key" }
    }
  },
  "$defs": {
    "key": {
      "type": "object",
      "required": ["id", "x", "y", "width", "height"],
      "additionalProperties": false,
      "properties": {
        "id": {
          "type": "string",
          "pattern": "^Keyboard_[A-Za-z0-9]+$",
          "description": "Unique within the profile. Names follow the US layout by convention, so on a German keyboard the physical Z is Keyboard_Y. That is naming only — the character is queried from Windows.",
          "examples": ["Keyboard_A", "Keyboard_Enter", "Keyboard_NonUsBackslash", "Keyboard_Num7"]
        },
        "x": { "type": "number", "description": "Left edge, in canvas units." },
        "y": { "type": "number", "description": "Top edge, in canvas units." },
        "width": { "type": "number", "exclusiveMinimum": 0 },
        "height": { "type": "number", "exclusiveMinimum": 0 },
        "row": {
          "type": ["integer", "null"],
          "minimum": 0,
          "description": "Matrix row, or null while the mapping is unknown. Both row and column must be given, or neither."
        },
        "column": {
          "type": ["integer", "null"],
          "minimum": 0,
          "description": "Matrix column, or null while the mapping is unknown."
        },
        "scanCode": {
          "type": ["integer", "null"],
          "description": "Overrides the standard scan code for this key. Needed where the physical layout disagrees with the US-based naming — the tall ISO Enter, or a key that exists only on JIS or ABNT-2. Extended keys carry 0xE0 in the high byte."
        },
        "parts": {
          "type": "array",
          "description": "Further rectangles belonging to the same key, for keys that are not rectangular. The ISO Enter is the standard case: one key, two areas.",
          "items": {
            "type": "object",
            "required": ["x", "y", "width", "height"],
            "additionalProperties": false,
            "properties": {
              "x": { "type": "number" },
              "y": { "type": "number" },
              "width": { "type": "number", "exclusiveMinimum": 0 },
              "height": { "type": "number", "exclusiveMinimum": 0 }
            }
          }
        },
        "label": {
          "type": ["string", "null"],
          "description": "What is printed on the key, for keys that type nothing — strg, entf, pos 1. It belongs to the keyboard, not to the language of the software: a German keyboard says \"Strg\" whatever Keylegend is set to. Keys that produce a character need no label."
        },
        "labelSecondary": {
          "type": ["string", "null"],
          "description": "A second line printed below the first — \"s-abf\" under \"druck\", or the navigation name under a number pad digit."
        }
      }
    }
  }
}
